Title,Text,Score,ID,Subreddit,URL,Num_Comments,Created
Apple Reportedly Suspends Work on Vision Pro 2,,2213,1dittcu,apple,https://www.macrumors.com/2024/06/18/apple-suspends-work-on-vision-pro-2/,681,1718725446.0
"After 12 hours inside, it's clear Apple mis-marketed the Vision Pro","I received my Vision Pro Friday morning, and have spent roughly 12-15 hours inside already. I have a couple thoughts I'd like to share, if anybody is interested.

This is without a doubt, the most incredible piece of consumer technology ever shipped. Unfortunately, I believe there was a breakdown internally at Apple between the R&D department and the marketing department in releasing this product.

Apple has focused on a variety of ""gimmicky"" features in marketing and demo'ing the AVP; dinosaurs, spatial video, EyeSight, FaceTime w/ personas, etc. This was a bit of an ""own goal"" on Apple's part, that has lead to a smattering of hit piece reviews, particularly Nilay Patels. His review, WILL NOT AGE WELL. I promise you all that.

These reviews are focusing on the gimmicky features Apple pushed towards the public to pique their interest. And due to this mis-marketing, muckraker reporters like Nilay Patel have called out Apple's mistake by focusing their reviews on the gimmicks, rather than the strength of the platform, which is truly groundbreaking. For instance, personas are irrelevant to this system. It's fun, it solves a small FaceTime issue. It should not have been a material part of Nilay's review, and instead he (and many others) decry Apple for putting out a weird uncanny valley beta avatar. This is akin to reviewing the first iterations of the Ford Model T, and saying ""I really can't believe you have to get out of the car and start it with a hand crank"". Then stating people shouldn't buy the car, and should stick with the horse and buggy, because it's not a convenient apparatus to start.

People are failing to understand that this is not a VR/AR headset that does X, Y, and Z. Apple developed a spatial computing platform (as properly marketed by Apple), which allows you to do whatever you'd like to do, and whatever developers can dream up. The Vision Pro, is simply the apparatus to see it through. The base of the spatial computing system and Vision OS 1.0 is truly remarkable and something I never thought I would see in my lifetime. Is it slightly buggy... actually NO! It's fairly rock solid, more so than I thought, and much more than appears in the vid captures from the device in reviews. These screencaptures do not do the OS justice, as it shows the ""foveated rendering"" which you cannot see with your eyes while using the device.

For instance last night, I was lying in bed, in a VR environment, looking at the stars, in crystal clear clarity, with a small window open talking to a friend via Messages, and just beyond that, mounted in the sky, was a 100 foot wide screen which had The Social Network running in simply the clearest quality I have ever seen outside of 15/70 IMAX.

This is a hard concept to market because it's so flexible. It relies on the creativity of the user in order to truly shine, just like a laptop. Some people will do amazing things with Mac OS, and some people will just answer emails and watch YouTube. This is a computing PLATFORM, not a DEVICE or a TOY.

In so many of these reviews, they simply pull up a safari window and watch YouTube and say ""that's cool, but really what else can we do?"" Then they show the poor personas and say, well Apple really missed the mark here. It's hard to describe just how much a window is like a piece of glass in Vision OS, that is SO ANCHORED DOWN in 3D space. It's up to the user to decide how to use this in a fun and productive way, and 99% of tech reviews, aren't that creative! I won’t even discuss the eye tracking technology, because it just works. It’s indescribably accurate. 

One more tidbit; from the design of the hardware, it is clear to me that the Apple Design team was aiming for a ""space travel"" / “moonshot” theme. The Vision Pro case is a dyneema-like covered padded box, similar to the boxes NASA uses with padding and white ripstop material on their space missions and in their spacesuits. The Vision Pro itself has a very ""Stormtrooper"" look. Even the orange release tabs for the headbands all scream ""space travel"", ""state of the art aviation"", and ""government special projects"" to me. I believe this is all because the intent of the product from the Design Dept. is to prepare you for traveling to another world, like the exploration of space, the final frontier. This is more akin to a Virgin Galatic flight than iPad. This is the final frontier of computing, and we will never return to physical screens again in a real way again.

&#x200B;

EDIT:

PS, this article is to illustrate how Apple's mis-marketing of the device lead to milquetoast reviews and a lot of public backlash / hate. It is my belief that these reviewers judged the product against Apple's marketing expectations (which is their right) vs. what was shipped in the box.

&#x200B;

I'm happy to answer any questions anyone might dream up.

Go buy a Vision Pro and experience a pull forward in consumer tech that is perhaps 5-10 years beyond our MacBooks and iPhones.",917,1ajki9t,VisionPro,https://www.reddit.com/r/VisionPro/comments/1ajki9t/after_12_hours_inside_its_clear_apple_mismarketed/,588,1707150343.0
Average person's review of the Vision Pro,"Here's my review of the Vision Pro (and why I'll be returning it) from a pretty average person's perspective. I want to add the caveat at the outset that this thing is totally magical. I loved the demo at the store and bought one on the spot. However, one of the reviews was right: it's magical until it's not anymore. As a note, I'm a super average user: mostly research and writing (legal field) with some video. This device has HUGE promise, but it'll take some time to iron things out. I'm going to try to focus on practical elements because I so wanted this thing to replace my computer. Also, I recognize that this is just day two and this device will make huge strides. However, those strides will come in spurts over the next two to three years, and won't be available any time soon.

Quick rundown of my notes:

* Loved the out of box functionality and feel. Everything is incredibly well thought-out (up to a point).
* Super cool environments.
* App functionality is limited.
* Not as many use cases. The internet is still designed for traditional computers (but this will likely change over time!).
* Heavy. So heavy.
* Passthrough complaints are overstated. I thought it was good!
* Good luck working at a desk and drinking coffee/tea with this thing on.

So I started using this thing yesterday after I picked it up, and the unboxing was fantastic as always. Eye tracking is super smooth, and it recreated the feeling of trying something truly ""futuristic"" for the first time. However, as I began to use it more, it's begun feeling more like a new screen that's just heavy and impedes interacting with my dog and fiancée. I do legal research and a lot of writing for a living, so I partially knew this may not work for me. I started by pairing it to my Mac for the screen sharing (Mac Virtual Display) and was immediately met by the seemingly standard Apple technical decisions: you can't... pair your AirPods with the Mac? The virtual display won't play audio from the Mac at all in fact? It's one of those dumb little quirks that will get ironed out, I'm sure, but when I anticipate so many will be using the virtual display, it's not great. I do like that I can blow up my screen to be huge, but also only being able to only have one instance of your Mac at a time rather than multiple windows is really disappointing too. I had hoped I'd be able to run two instances side-by-side to give me unlimited monitor space, but that's likely for future generations. However, my workaround has been to have a Safari instance open alongside the virtual display, as well as Apple Music. It still feels kind of bad that I can't just natively use YouTube in my Mac's instance, but that can be sort of remedied by the Safari workaround for now (didn't bother to pay for Juno).

Also, minor frustration that can easily be worked out (and likely will be soon): I can't pair my MX Master mouse? Passthrough with my keyboard works perfectly, but there's no mouse functionality and the Vision Pro says my mouse isn't supported. That kind of sucked for navigating things easily outside of virtual display.

The actual functionality of VisionOS is pretty much perfect. I love its feel, and it's super responsive. I'm also certain that it'll improve immensely over time, adding cool new features we didn't know we wanted/needed. It will also hopefully influence the way we use the internet—the current internet architecture is for phones, but spatial computing is so cool. But for now, opening up Reddit on this thing is just like being on my laptop or phone. I guess one minor concern is that this is a walled garden machine with a lot of DRM capabilities, and part of me laments that the open-ended nature of the laptop might go away if this thing takes off.

For actual work, it's cool. I like that I can be sitting at Mt. Hood and writing, and that you can adjust your environment's wraparound so you can still see things like your door. However, it's still a little strange to me to feel, in a way, blinded and deafened (if I'm wearing my AirPods). Not as much of an issue because you can always use the admittedly very good speakers built into the headset and there's the passthrough functionality, but it's still a little unsettling to someone who has a dog. I can't really see him and I guess I didn't expect to but it's weird to not interact with him as much as I would if I was sitting at a computer. I get why some reviewers have said it feels a little more lonely in here. If I was single and didn't have a pet, this would probably be more ""useful"" if that makes sense. I've been able to work well on this device, but it all more or less happens within an instance of my Mac, which makes this feel a little like an extra step. A lot of people might end up feeling like this is an iPad analogue rather than a regular computer: it's very much ALMOST there, but may just end up becoming a more niche device that people can't fully use for work but like to use for some work purposes.

As I've been working, the novelty has been fading more, which is good! I think the novelty is a huge selling point, which I certainly appreciate. However, at the end of the day, it's an eye computer. I like that I can watch sports on a big screen, but I also like to watch sports socially, so this is a little weird. However, if they end up adding functionality where I can get a seat at a stadium for a soccer or football game and feel like I'm there, that would be so awesome. I would use this thing almost solely for that if I could, but again, it makes more sense for people who are alone—I'm a social sports watcher and not having someone else be able to see what I'm seeing and react to that with me would leave me feeling like something is missing. For TV/movies, that's certainly the number one use case, but again, because it's strapped to your eyes, it's a necessarily solo experience. I'm sure some will roll their eyes and say ""what did you expect? It's an AR/VR headset."" And they'd be correct, but that also limits some of its use cases to being highly individualized necessarily. The magic of this thing is definitely in immersive experiences, and they're something I'm excited for, but only in small doses. I don't really want to ""live"" in this thing—I want to use it every so often for a movie when my fiancée is watching TV or I'm lounging around with some downtime and I'm not socializing. It's a really cool unplugging type of device, but one for limited time quantities.

This is also due to the weight. I'm sure my neck muscles would get stronger over time, but I can't let this thing sit on my head for more than 45 minutes. I wrote this review while in the Vision Pro, and already I'm feeling the neck strain. I'm wearing the dual loop strap, and it's fantastic, but even that can't save me from the weight fatigue. Using this thing on a long-haul flight (as I had originally intended) might be okay give the back and head rests, but absent that, it's a little tough.

I don't care about the personas stuff but the debate is also pointless to me: it's an eye computer that's approximating your entire face. It'll improve in time, but even the way they look now is mostly fine. That said, I would not show up to a Zoom call for work with a persona in its current state (though I also wouldn't show up using a persona probably ever for what it's worth). 

Another issue for future generations to work out: I can't see my iPhone. I would love if the Vision Pro could just display your iPhone's screen within the Vision Pro's screen. For dealing with annoying Duo notifications or checking emails quickly, this is a must-have for me, which mars the experience a little more.

Finally, I can't drink tea with this on. I'm sure that's funny but every time I lift my mug up to my face, it clinks against the visor and I have to be very careful about how I angle it to get a sip. I don't know if this can even really be solved for (maybe a slimmer facial profile?) and I know this is very silly, but it just leaves me asking myself ""why not just use a regular computer?""

In sum, this is a really amazing device that blew my mind when I first used it. However, beyond the novelty, it's left me feeling like I'm using a computer with extra steps. I will be returning it, but this thing has SO much promise. I went in wanting to love it as much as the demo, but it still just can't compete with my regular computer. In a few generations, it may be very competitive with that, but for now, it's worth skipping. Most people are average like me and won't have much use for it beyond cool movies and showing it to your partner who then asks ""why is there $3500 missing from our bank account?""",101,1ahvgth,VisionPro,https://www.reddit.com/r/VisionPro/comments/1ahvgth/average_persons_review_of_the_vision_pro/,151,1706964834.0
"Apple slashes Vision Pro production, cancels 2025 model in response to plummeting demand",,16005,1cc26z3,gadgets,https://www.techspot.com/news/102727-apple-have-slashed-vision-pro-production-canceled-next.html,2487,1713975136.0
Over 60 Days with Apple Vision Pro - Reflections and Experience - No more hate,"I've been using headsets for over 7 years now. I've practically tried out every Virtual Reality headset out there (except for some professional ones): HDK OSVR 1.4, PIMAX 4K, PIMAX 8k, PIMAX 8KX, PIMAX 5K Super, PIMAX Crystal, Oculus Rift, HTC Vive, Vive Pro, Vive Cosmos, Vive Pro 2, Vive XR Elite, Valve Index, Rift S, Quest 1, Quest 2, Quest Pro, Magic Leap, nReal, DPVR E4, and currently Quest 3 and Apple Vision Pro.

I don't think I could even count the hundreds of hours I've spent using all this technology. I'm involved in XR outreach, and well, I've had quite a privileged position in all of this. Additionally, many of you might know me as a member of Infinity One and as one of the creators of Air Cover.

For me, the Apple Vision Pro is the most impressive Extended Reality headset I've ever tested, both in terms of technology and user experience. It hasn't revolutionized anything, but it has stirred up the market with a different vision than we've had in recent years.

The Apple Vision Pro has the best screens I've seen, the best sound, the best passthrough, the best gesture recognition, and the best interface I've encountered in a device of this kind. It's intuitive, easy to handle, although there are times when I'd like to smash it against the ground when the eye tracking doesn't work as it should. Then I remember its cost, and that thought slips away.

When Tim presented it, I saw it clearly: they provide the Hardware, and it's the ""obligation"" of developers to create content to make this gadget usable. And I think this is the main problem many people are having: usability.

Apple marketed it as a space computing system where you can work with spatial multitasking windows and connect it to our Macs (or PC with moonlight, Immersed, etc), as well as a device to view flat and immersive multimedia content. Unfortunately, the media hype surrounding it led many people to be interested in it, especially because they were goofing around in their TikTok and YouTube videos.

[Air Cover + Nylon Strap + Monster Mod BOBOVR 😂](https://preview.redd.it/4tv8v1s0hzzc1.png?width=1280&format=png&auto=webp&s=1ee16c2a43d84a847ea2a925642ae340192b1fe8)

Luckily, I'm a restless person and I give a lot of usability to the Apple Vision Pro, not only to start designing contraptions to improve ergonomics like this one I'm showing you with a sliding system to place the battery on the back using part of a BOBOVR Strap from the Quest 2 (It was just an experiment, and I had to withdraw it because of the excessive weight it entailed using it like that.), but also for what I'm about to tell you:

* It allows me to use my virtual PC screen (moonlight) to work with it.
* I have multitasking systems with Telegram, Discord, Mail while the main focus is on the Moonlight screen.
* It allows me to connect to SteamVR (PC) via ALVR. Yesterday, I spent about 4 hours in VRChat with the Apple Vision Pro and without controllers (using hand tracking to move).
* It allows me to watch multimedia content alone or with company.
* It allows me to meet with part of the Apple Vision Pro community with Spatial Persona and chat with them.
* It allows me to show my designs to friends or family via Facetime.
* It allows me to browse these forums and stay up-to-date on news of all kinds.
* It allows me to control all 3D printers with their iPad applications.
* It allows me to play Arcade games by connecting the PS5 controller.
* It allows me to watch spatial videos of my son or my pets (I have an iPhone 15 Pro).
* It allows me to write scripts (I have a foldable Bluetooth keyboard) with a touchpad, and by activating Assistive Touch, I can use it as a mouse.

In short, it allows me to use it for everything I want and more. Still, the product is not perfect:

* The weight distribution is terrible. Apple needs to work a lot on this. We designed the Air Cover and the Nylon Strap to achieve the most bearable balance possible.
* It doesn't have virtual controllers, which would have been great for immersive gaming (although I have a feeling Apple doesn't want this type of content).
* We lack more specific content for a particular use, taking advantage of the benefits of Mixed Reality or Spatial Computing. The famous ""killer app"".
* Its price is a significant barrier for consumers, but not for developers or businesses that truly want to harness the potential of this device. The average person will only be able to buy it if they have that money and will truly make use of it.

We are at the birth of this device, a product that due to its high price and the amount of integrated technology is more than evident that it is a development product, so that all developers can use it and create unique experiences. Still, it's a product that can reach consumers, for people who can really afford it and want to use it, but without a doubt, it's a great product.

I understand the frustration of many people who have spent more than $3500 and end up returning it or leaving it in a drawer because they don't know how to use it, but personally, I am very happy with the purchase and extremely proud to own Apple Vision Pro.

What must be clear is that if you're one of those people who enjoys using Apple Vision Pro, keep doing so. Don't let yourself feel down if you go to any place and are bombarded with negative information. Generally, dissatisfied people complain, while those who enjoy something don't go to a forum to talk about it 😉

PD: Apologies if my English isn't very good; I hope everything is understood well 😅",134,1cq670r,VisionPro,https://www.reddit.com/r/VisionPro/comments/1cq670r/over_60_days_with_apple_vision_pro_reflections/,51,1715514965.0
Just tried the Apple Vision Pro today. Not impressed ,"Got an AVP demo at the Apple store today… and all I can think is thank God I saved my money. 

I’ll start with the bad

Hand tracking has serious latency issues, q3 actually has equivalent or better hand tracking imo. I had quite a few missed taps and moving my hands around with something virtual tracking them showed that there’s at least 60-100ms of latency for hand tracking. 

Eye tracking either has minor latency issues or the responsiveness of highlighting is messed up. Psvr2 has quicker and more accurate eye tracking imo. 

The fov is god awful. I think my original vive had better fov, it can’t be more than 70-80 degrees based on what I experienced. You get used to it pretty quickly but there was major shock having played my q3 immediately before. Undoubtedly they play it safe with the closeness of the headset for demos, and this would improve from getting the lenses closer, but this was my experience and the lenses are very small compared to others on the market now. (Had to edit this)

The brightness is extremely lacking, pass through feels like you’re wearing sunglasses. 

We’re still far away from “wow I can’t tell I’m wearing a headset” level pass through. They managed to eliminate the wavy outlines that occur in quest pass through when you hold your hand or phone up, but whatever they did to fix this made depth perception difficult. 

3D videos taken on the avp look like they’re recorded in 720p, although the vids taken from iPhone were actually quite impressive. 

The occlusion with your hands being visible in environments is the best I’ve seen, but it’s still far from perfect. Tons of edges peeking through. 

It is wildly uncomfortable, major pressure on my forehead and considering maybe 100,000 people bought one at most, there’s not going to be any 3rd party facial interfaces. 

Now for some good, I’ll give credit where credit is due. 
Resolution is stunning, best I’ve seen, but that’s also with a small field of view so…. PPD is artificially increased by that. 

8k high framerate vr videos look AMAZING, this is the one thing i say they’ve done absolutely incredibly. Movies look good too and you can really see the detail. 

Rendered things such as environments and the Dino demo look STUNNING like… as good or better than pc graphics. 

The windows do stay put and the shadows are cool. 


TLDR; it’s about 50% better than the quest 3 in terms of the overall experience, but 700% more expensive, and without controllers or games, they really shit themselves on this one. Tons of potential, most of it missed. I would not want to use this for anything productive, it’s majorly uncomfortable, and productivity is the only use case I could possibly see with this device. I’d maybe pay $300 for this, not 3500. For the price of a Varjo headset, I expect to be blown away at everything, but it’s just a good bit better than other hmds at certain things, and drastically lacking in other departments. ",41,1ct4d74,virtualreality,https://www.reddit.com/r/virtualreality/comments/1ct4d74/just_tried_the_apple_vision_pro_today_not/,140,1715832533.0
I worked exclusively in Vision Pro for a week—here’s how it went,,418,1b69rn6,apple,https://arstechnica.com/gadgets/2024/03/i-worked-exclusively-in-vision-pro-for-a-week-heres-how-it-went/,148,1709555414.0
