Title,Text,Score,ID,Subreddit,URL,Num_Comments,Created
One month review of Vision Pro as a hardcore PCVR user,"Okay I’ve been using my Vision Pro for a month and here is what I though about this product overall.


Comfort: this is an issue mentioned by many tech reviewers and non hardcore VR users, “it’s heavy blah blah blah”
This thing is not lightweight compared to Xreal Pro 2 but for us, VR hardcore users who haven been trained by something like Pimax Crystal, Varjo XR4( both are 2 pounds/1kg+ hmds), VP is nothing in fact I can now use it for several hrs seated with solo knit band for web browsing & movie viewing. If you get the right facial gasket, the pressure points can be adjusted to the forehead rather than the cheekbones, which is quire comfortable.


FOV: 21W is doing the magic for me to get close to Quest 3/Pro horizontal FOV and vertical is also not that bad anymore, again this device is not very sensitive to FOV as a mixed reality headset.


Input method: eye tracking+hand gestures is not yet accurate enough to be the only input method, the more I use it, the more I feel like this is just a PSVR2 level eye tracking, for simple game menu it’s fine but for productivity and even just web browsing, a lot times I can’t choose the right tab/words I want even I’m pretty sure I’m staring at what I want to select, Apple, plz improve this with your next gen VP with best eye tracking module you can buy, this PSVR2 level accuracy is a joke for general computing, in fact I feel Quest 3 is easier to use with hand tracking despite many ppl don’t like its UX/UI.


Build quality: 10/10, better than Varjo XR4, those Chinese really know how to make good consumer electronics nowadays. But the solo knit band is certainly not worth $100 each…I was considering getting 2nd one for top strap mod but I think I’m good for now.

Productivity:
No one mentioned but you can still have tiny bit flickering with text sometimes, best headset for productivity but it’s still not perfect compared to traditional 4K monitors.


The Digital Crown with immersive environment is probably the most realistic Virtual experience I’ve ever seen, even better than some 4090 powered PCVR mods including those Unreal Engine tech demo, thx to the fantastic Sony micro OLED panel, I wish PCVR can have access to that one day …",231,1bai8b0,virtualreality,https://www.reddit.com/gallery/1bai8b0,148,1709992415.0
"Apple Vision Pro U.S. Sales Are All But Dead, Market Analysts Say - Less Than 100k Units Shipped",,15357,1e0t88e,technology,https://gizmodo.com/apple-vision-pro-u-s-sales-2000469302,2342,1720715584.0
Apple Vision Pro,,14571,1ai9a0g,HolUp,https://v.redd.it/qcm7jqspeggc1,964,1707002528.0
vision pro kids,,12143,1aj235i,facepalm,https://i.redd.it/w1ro4necmngc1.png,782,1707089846.0
Apple Vision Pro,"Get the warranty, if it’s an apple quality product you’ll need it.",72165,142qj4s,memes,https://i.redd.it/c7eo1b1d7g4b1.jpg,1771,1686079281.0
Guy using Apple Vision Pro on NYC subway.,,24007,1aiagvp,interestingasfuck,https://v.redd.it/omvemzbkoggc1,3736,1707005780.0
The Simpsons predicted the Apple Vision Pro. ,,30034,1ajaf60,BeAmazed,https://v.redd.it/nuv3mt3qspgc1,787,1707116134.0
Apple Vision Pro prices,"256GB: US$3499
512GB: US$3699
1TB: US$3899

AppleCare+ Costa US$499",1819,19ailje,apple,https://www.apple.com/shop/buy-vision/apple-vision-pro,1239,1705669360.0
Apple Vision Pro honest review,,13959,1ajb97q,HolUp,https://v.redd.it/sume1xqj2qgc1,189,1707119533.0
Apple Vision Pro,,3355,1ak9aye,BrandNewSentence,https://i.redd.it/a0y5ksswvxgc1.jpeg,210,1707224751.0
A software engineer wore an Apple Vision Pro to his wedding,,29439,1b37gjb,facepalm,https://i.redd.it/yorijh2hiklc1.jpeg,1903,1709231391.0
Apple's VR Headset - Vision Pro,,4838,141ngvl,virtualreality,https://i.redd.it/fov95th8s84b1.jpg,2863,1685989453.0
New Apple Vision Pro review,,10927,1aji8cn,shitposting,https://v.redd.it/uvr1f2t05sgc1,150,1707144504.0
Zuck on the Apple Vision Pro,,1976,1aqaudj,apple,https://twitter.com/pitdesi/status/1757552017042743728,1008,1707874639.0
Apple Vision Pro in the Future,,3121,1av74av,Damnthatsinteresting,https://v.redd.it/keikkzsbonjc1,422,1708398180.0
Apple Reportedly Suspends Work on Vision Pro 2,,2167,1divwec,gadgets,https://www.macrumors.com/2024/06/18/apple-suspends-work-on-vision-pro-2/,664,1718730654.0
"This is Apple Vision Pro, the mixed reality headset",,17129,141nglc,apple,https://9to5mac.com/2023/06/05/apple-vision-pro/,9172,1685989435.0
League in Vision Pro works,,2852,1akjfpj,leagueoflegends,https://v.redd.it/wrxnpn6rw0hc1,332,1707250691.0
Apple Cuts Vision Pro Shipments As Demand Falls 'Sharply Beyond Expectations',,5846,1cbawhb,technology,https://www.macrumors.com/2024/04/23/apple-cuts-vision-pro-shipments/,1388,1713894340.0
Apple Vision Pro Unboxing!,,1603,1aep5fe,apple,https://www.youtube.com/watch?v=SaneSRqePVY,438,1706623433.0
Excellent Demonstration Of Vision Pro Setup,,2175,1aifllk,apple,https://www.youtube.com/watch?v=BV9Xy6L_rlM,644,1707021735.0
"Apple Has Sold Approximately 200,000 Vision Pro Headsets",,4152,1ae9j5j,technology,https://www.macrumors.com/2024/01/29/apple-vision-pro-headset-sales/,1275,1706570699.0
Software engineer wore an Apple Vision Pro to his wedding,,8325,1b2zxrd,pics,https://www.reddit.com/gallery/1b2zxrd,617,1709212154.0
Working in the Vision Pro,,1816,1ai37t7,VisionPro,https://www.youtube.com/watch?v=BV9Xy6L_rlM,485,1706986374.0
the thing no one will say about Apple Vision Pro,,4281,1ai5xfo,apple,https://youtu.be/UvkgmyfMPks?si=2ZEIHsXFLI2XFo9C,1371,1706993616.0
Using Apple Vision Pro: What It’s Actually Like!,,3263,1afjm5d,apple,https://youtu.be/dtp6b76pMak?si=VSGTMVtMu37-qdYb,1123,1706712774.0
"Apple Vision Pro review: magic, until it’s not",,2743,1aep8r6,apple,https://www.theverge.com/24054862/apple-vision-pro-review-vr-ar-headset-features-price,1343,1706623688.0
Apple Vision Pro Impressions! - MKBHD,,2282,1426ix4,apple,https://youtu.be/OFvXuyITwBI,1386,1686033604.0
Runescape on the Apple Vision Pro,,2153,1ahp1ip,2007scape,https://v.redd.it/4ixvtup07bgc1,317,1706939447.0
Apple Vision Pro available in the U.S. on February 2,,3974,191ltc7,apple,https://www.apple.com/newsroom/2024/01/apple-vision-pro-available-in-the-us-on-february-2/,1494,1704722338.0
Mark just posted a video on Quest 3 x Apple Vision Pro,,4919,1aq8rkt,OculusQuest,https://v.redd.it/hjg4v8zwyfic1,1243,1707868879.0
Vision Pro ,,2937,1ajgqqe,funnyvideos,https://v.redd.it/6ro0zw5xsrgc1,74,1707140414.0
"Apple Vision Pro Sold Out, At Least For Pre-Order",,2808,19aq9vi,technology,https://www.forbes.com/sites/johnkoetsier/2024/01/19/apple-vision-pro-sold-out-at-least-for-pre-order/,969,1705689660.0
"$AAPL Vision Pro, letting me lose my savings in VR",Might have to go all in on Apple calls ,6412,1ajkvw6,wallstreetbets,https://v.redd.it/09ce1ud6psgc1,314,1707151269.0
Vision Pro concepts,,1221,1chsr8k,Holdmywallet,https://v.redd.it/feiqpqo1uuxc1,137,1714586605.0
Apple Vision Pro 😂,,4524,1434ieq,ProgrammerHumor,https://i.redd.it/qwz3gwj09j4b1.jpg,167,1686116159.0
Apple Vision Pro Owners Are Struggling to Figure Out What They Just Bought,,5913,1am5e63,technology,https://nymag.com/intelligencer/article/apple-vision-pro-owners-are-wondering-what-they-bought.html,1369,1707424157.0
Hello Apple Vision Pro,,826,1adfo56,apple,https://youtu.be/IY4x85zqoJM?si=Sdo_O7DfD0-LMvWJ,468,1706482421.0
Making Apple Vision Pro,,1410,19codw6,Damnthatsinteresting,https://v.redd.it/peoaefr6hxdc1,216,1705901587.0
This is Safari for Apple Vision Pro,,1447,18ude0t,apple,https://twitter.com/M1Astra/status/1740994796246724758,653,1703934584.0
Apple's Vision Pro Won't Launch With Netflix App,,1751,1999e1v,apple,https://www.bloomberg.com/news/articles/2024-01-17/watching-netflix-on-apple-vision-pro-you-ll-have-to-use-the-web,527,1705529561.0
Apple Vision Pro reaches India,,1192,1ao0wpw,IndiaTech,https://v.redd.it/tqmn1kh4bwhc1,274,1707630819.0
$APPL Vision Pro letting me short $BA from 30k feet in the sky,Gonna end up shorting Apple.  Cannot wear the Vision Pro for more than an hour without it smushing my head into a migraine.,7456,1all0lt,wallstreetbets,https://v.redd.it/uuz3jjrhw9hc1,540,1707359562.0
Apple reportedly cuts Vision Pro production due to low demand,,1572,1cbr213,technology,https://www.theverge.com/2024/4/23/24138487/apple-vision-pro-cut-shipment-forecast-kuo-rumor,626,1713938823.0
Get Ready | Apple Vision Pro,,1125,1921q3q,apple,https://www.youtube.com/watch?v=aqTIB_q40bo,431,1704762215.0
Wedbush: Apple 'renaissance' inbound after Vision Pro launch,,1327,1ajz7wp,apple,https://appleinsider.com/articles/24/02/04/apple-renaissance-inbound-after-vision-pro-launch-success,565,1707187238.0
The Simpsons predicted the Apple Vision Pro.,,3383,1ajagez,interestingasfuck,https://v.redd.it/tf1r6z54tpgc1,141,1707116265.0
Apple’s Vision Pro AR headset is finally here,,2241,141nh1v,technology,https://techcrunch.com/2023/06/05/apple-headset/,2172,1685989463.0
Introducing H3 Vision Pro,,1683,1c3j2j4,h3h3productions,https://v.redd.it/00sgpadaxcuc1,98,1713062297.0
You can’t edit your Apple Vision Pro home screen: visionOS apps are arranged alphabetically,,1794,1afa6lt,apple,https://9to5mac.com/2024/01/30/apple-vison-pro-home-screen-apps-alphabetically/,449,1706678561.0
"Apple Vision Pro Owners Complain of Headaches, Neck Issues and Black Eyes",,2824,1c02qy6,gadgets,https://www.macrumors.com/2024/04/09/vision-pro-owner-pain-complaints/,476,1712695572.0
Apple Vision Pro Manufacturing,Via Tim Cook Twitter,1780,19ajrms,ManufacturingPorn,https://v.redd.it/j7rverv7ledc1,123,1705672893.0
The missing vision of the Apple Vision Pro,,2882,1ccbnq3,dankmemes,https://i.redd.it/nw9grunq6iwc1.jpeg,42,1713997799.0
Wunkus vision pro,,3490,1aiwggo,wunkus,https://i.redd.it/sv3s1ntggmgc1.jpeg,46,1707075691.0
Introducing Apple Vision Pro,,840,141okqf,apple,https://www.youtube.com/watch?v=TX9qSaGXFyg,620,1685992216.0
Vision Pro as Night Vision is so cool!,"If you haven’t yet, try using one of the apps like A Magic Room to show the scan of your house in pitch black, it’s amazing! It will overlay the scan of your home in real time allowing you to essentially see using the LiDAR scanners!",1129,1augos9,VisionPro,https://v.redd.it/20m47v2jlhjc1,121,1708324416.0
Apple Vision Pro Lacks Wi-Fi 6E Support,,1336,198c8ys,apple,https://www.macrumors.com/2024/01/16/apple-vision-pro-lacks-wi-fi-6e-support/,378,1705435146.0
Honkai Star Rail is coming to Apple Vision Pro,,2230,1ah4et5,HonkaiStarRail,https://i.redd.it/0faznu6ei6gc1.jpeg,247,1706882627.0
First Impressions of Vision Pro and VisionOS,,733,143lt23,apple,https://daringfireball.net/2023/06/first_impressions_of_vision_pro_and_visionos,481,1686164615.0
"Apple Has Sold Approximately 200,000 Vision Pro Headsets",,1499,1aehsmf,apple,https://www.macrumors.com/2024/01/29/apple-vision-pro-headset-sales/,393,1706595676.0
Apple employees who worked for the Vision Pro get a nice gift,,2724,1ali2bo,apple,https://twitter.com/kaubin/status/1755312748760629684,470,1707351035.0
"MKBHD Vision Pro Review: Tomorrow’s Ideas, Today’s Tech",,1359,1aicbzc,apple,https://youtu.be/86Gy035z_KA?si=8rLyPqf8lA_yKWC3,647,1707011250.0
Apple Vision Pro Could Take Four Generations to Reach 'Ideal Form',,1820,1aobuz1,apple,https://www.macrumors.com/2024/02/11/apple-vision-pro-fourth-generation-ideal/,565,1707668805.0
"YouTube and Spotify Won’t Launch Apple Vision Pro Apps, Joining Netflix",,2579,19a2opg,apple,https://www.bloomberg.com/news/articles/2024-01-18/youtube-and-spotify-join-netflix-in-not-launching-apple-vision-pro-apps?utm_source=website&utm_medium=share&utm_campaign=copy,803,1705616494.0
"Apple Vision Pro is priced starting at $3,499. Available early next year.",,3949,141ogdb,apple,https://twitter.com/macrumorslive/status/1665796280860254214,2945,1685991804.0
Apple Asks Customers for Vision Pro Feedback,,703,1ce5jrd,apple,https://www.macrumors.com/2024/04/26/apple-asks-customers-for-vision-pro-feedback/,335,1714191293.0
"Apple Vision Pro Sold Out, At Least For Pre-Order",,1467,19axesl,gadgets,https://www.forbes.com/sites/johnkoetsier/2024/01/19/apple-vision-pro-sold-out-at-least-for-pre-order/?sh=6675a86c351c,534,1705707547.0
Apple 'Carefully Orchestrating' Vision Pro Reviews With Multiple Meetings,,1136,192yvf2,apple,https://www.macrumors.com/2024/01/09/apple-vision-pro-reviews-multiple-meetings/,595,1704858789.0
Netflix CEO says Apple Vision Pro market is irrelevant for now,,1754,19fmjil,apple,https://appleinsider.com/articles/24/01/25/netflix-ceo-says-apple-vision-pro-market-is-too-insignificant-to-bother-with?utm_medium=rss,535,1706223903.0
Apple workers outnumbered customers at Vision Pro launch in downtown San Francisco,,2452,1ahgq9i,apple,https://www.sfgate.com/tech/article/apple-vision-pro-sf-union-square-launch-crowd-18644828.php,440,1706914272.0
"$3,500 Apple Vision Pro vs. $350 Meta Quest:",,2343,14819yi,StockMarket,https://i.redd.it/ffiponhddo5b1.png,466,1686614031.0
Handful of Apple Vision Pro Units Develop Identical Crack in Cover Glass,,2351,1ay1r8x,gadgets,https://www.macrumors.com/2024/02/23/apple-vision-pro-front-glass-cracked-reports/,351,1708698463.0
Unofficial YouTube App for Vision Pro by Apollo Reddit App Developer,,2799,1ah021a,apple,https://apps.apple.com/us/app/juno-for-youtube/id6476961640,326,1706867173.0
Apple Vision Pro Could Take Four Generations to Reach 'Ideal Form',,1776,1aof7tv,gadgets,https://www.macrumors.com/2024/02/11/apple-vision-pro-fourth-generation-ideal/,404,1707677227.0
"Apple Is Reportedly Scaling Back Production Plans of Its $3,499 Vision Pro Mixed Reality Headset",,11178,14qb46j,technology,https://www.ign.com/articles/apple-is-reportedly-scaling-back-production-plans-of-its-3499-vision-pro-mixed-reality-headset,1863,1688465348.0
"Apple Vision Pro review: magic, until it’s not",,950,1aep9q8,technology,https://www.theverge.com/24054862/apple-vision-pro-review-vr-ar-headset-features-price,541,1706623764.0
"Apple Vision Pro is 'tomorrow's technology today,' says Tim Cook",,1243,1ah64c3,apple,https://appleinsider.com/articles/24/02/02/apple-vision-pro-is-tomorrows-technology-today-says-tim-cook,478,1706887179.0
A software engineer wore an Apple Vision Pro to his wedding,,2802,1b3m6h1,weddingshaming,https://i.redd.it/yorijh2hiklc1.jpeg,200,1709269799.0
Netflix says Vision Pro is too 'subscale' for it to care about,,1873,1ab5fbi,technology,https://9to5mac.com/2024/01/25/netflix-vision-pro-app/,502,1706230426.0
Apple Vision Pro: Guided Tour,,546,19ak5xa,apple,https://www.apple.com/apple-vision-pro/guided-tour/,325,1705674020.0
Vision Pro hands-on photos,,424,198c0a7,virtualreality,https://www.reddit.com/gallery/198c0a7,472,1705434542.0
'Peak Bengaluru moment' Man spotted using Apple Vision Pro,,1373,1aqbgwg,IndiaTech,https://i.redd.it/vzrv87ejlgic1.jpeg,257,1707876451.0
Steve Jobs had the Vision Pro on the roadmap already in 2007,,3786,14aujg7,wallstreetbets,https://v.redd.it/p3h2vo3m9d6b1,506,1686915457.0
Apple’s Lead Marketer for New Vision Pro Headset Retires,,1158,1ccan3y,gadgets,https://www.bloomberg.com/news/articles/2024-04-24/apple-s-lead-marketer-for-new-vision-pro-headset-retires,280,1713995243.0
Apple Reportedly Suspends Work on Vision Pro 2,,595,1divwhx,technology,https://www.macrumors.com/2024/06/18/apple-suspends-work-on-vision-pro-2/,269,1718730661.0
[OC] Vision… Pro?,,2565,1aobxrd,funny,https://i.redd.it/mou2jxoogzhc1.jpeg,35,1707669001.0
Vision Pro’s coming. What are your AAPL moves??,,1091,19bvaqw,wallstreetbets,https://v.redd.it/kbmyqzax3qdc1,362,1705812359.0
Can confirm osrs works on vision pro,,1163,1aicq8l,2007scape,https://v.redd.it/zbnvzppf8hgc1,185,1707012475.0
Vision pro my ass,,3032,14bgqkj,HolUp,https://i.redd.it/prh2aj9v4i6b1.jpg,81,1686974354.0
"Apple Vision Pro U.S. Sales Are All But Dead, Market Analysts Say - Less Than 100k Units Shipped",,3727,1e0t8bb,gadgets,https://gizmodo.com/apple-vision-pro-u-s-sales-2000469302,578,1720715589.0
Vision Pro engineers moved to folding iPhone; delayed to 2027,,1219,1bptx47,apple,https://9to5mac.com/2024/03/28/folding-iphone-project/?fbclid=IwAR0mw_dEH8dNfSw0msj_5b2C4b89dsofGnltF6iZUCpU8bEe52QyX28ND6M_aem_AX88IYNB6exR9c37FJbWyy0SvdncviYbJIdAiEosUVbPjCodRAPkSYpEJQ67uTx6cEE,381,1711627479.0
"Apple reportedly ’accelerating’ entry-level Vision Pro — and it could cost $2,000 less",,2567,1bj0lri,apple,https://www.tomsguide.com/computing/vr-ar/apple-reportedly-accelerating-entry-level-vision-pro-and-it-could-cost-dollar2000-less,529,1710895453.0
Vision Pro,,1000,143d5hj,oculus,https://i.redd.it/zqbgbtrdgh4b1.jpg,144,1686144062.0
Nobody cares if you returned your Vision Pro.,What the hell is going on in this sub.,650,1aqzzld,VisionPro,https://www.reddit.com/r/VisionPro/comments/1aqzzld/nobody_cares_if_you_returned_your_vision_pro/,439,1707950379.0
Why Tim Cook Is Going All In on the Apple Vision Pro,,1438,1agaawh,apple,https://www.vanityfair.com/news/tim-cook-apple-vision-pro,506,1706791967.0
"Apple fans are starting to return their Vision Pros | Comfort, headache, and eye strain are among the top reasons people say they’re returning their Vision Pro headsets.",,4937,1ar1kq0,gadgets,https://www.theverge.com/2024/2/14/24072792/apple-vision-pro-early-adopters-returns,901,1707954498.0
Apple Vision Pro Spatial awareness is incredible,,824,1ahmnaa,virtualreality,https://v.redd.it/suuzfgcjjagc1,246,1706931448.0
"Vision Pro EyeSight feature doesn't really work, argues Macworld",,1428,1an8pc4,technology,https://9to5mac.com/2024/02/09/vision-pro-eyesight-feature/,259,1707542042.0
Apple Vision Pro Supports Up to 100Hz Refresh Rate,,1283,174fyap,apple,https://www.macrumors.com/2023/10/09/vision-pro-100hz-refresh-rate/,379,1696925945.0
Obsidian on Apple VisionPro,,946,1ahiuyw,ObsidianMD,https://v.redd.it/evx8vxztk9gc1,131,1706919923.0
Vision Pro scalpers used bots to place thousands of pre-orders,,1305,19epfpz,apple,https://9to5mac.com/2024/01/24/vision-pro-scalpers-bots/,405,1706125828.0
Apple Vision Pro Customer Interest Dying Down at Some Retail Stores,,981,1ca979i,technology,https://www.macrumors.com/2024/04/22/apple-vision-pro-customer-interest-dying-down/,346,1713788172.0
