Title,Text,Score,ID,Subreddit,URL,Num_Comments,Created
[Long post]Tried Vision Pro. Here's what I thought,"I tried Vision Pro a few days ago. All I can say is, congratulations, if you bought Quest 3, you would get 80% of what vision Pro can offer, if not more.

This is not a review - but this would be a much closer experience than all the guided tour reports Apple carefully curated so far.

After I walk into the room, the Vision Pro is already on the table. I picked up the device, it *feels* like Quest3, with Apple's signature glass and metal. It's heavy, and the shiny front plate is an obvious fingerprint magnet. It's not brand new, so the Rift CV1 style fabric on the eye side feels a little dirty and worn out - keeping it in pristine luxury condition might not be easy. The lenses are smaller than Quest 3 and more squarish, and I feel the field of view is also smaller than Quest 3.

When put on the headset you see the real world, and I was immediately struck by the clarity compared to Quest 3 - but that's expected. Tutorial time - raise your hand and align to instructions, pinch to tap, eye tracking - look at 6 dots and tap to confirm, under 3 lighting conditions. Then log in. You see the Apple logo and then signature Hello, like their WWDC videos.

But there's red fringing on the top and green fringing on the bottom of the apple logo against passthrough background, besides the chromatic aberration on the side of your FOV. Hmm, color fringing? I did not expect this - and this won't be the last.

The ""familiar home menu"" pops up. The screen looks good - no screen door effect, crisp icons and animation activated when I looked at them one by one.

Let me examine this acclaimed video passthrough against glowing reviews.

I looked down at my hands. really great, I can see skin details clearly, no distortions, all as expected. But I glance 15 feet across the room and motion blur of people walking is obvious. Huh. didn't heard people talk about that. And noise - suddenly, it struck me as Quest 3 level, of course better, but not by a mile. Then I look at a display on the desk about 4,5 feet away, the side of display is obviously distorting. that's surprising, since all I heard about was ""Perfect passthrough"". I move my head around, the wobble continued. I looked at my hand again, everything seems fine. I took out my phone and look at it, while clear, some distortion also arised in the middle of the phone. 

And after the initial impressiveness of the VST clarity wears off, the discrepancy of scale was showing up too - it's bigger than real life. I even pulled off the lightseal from the device, so I can see real world above and below with VST in the center of my view. The cut off between virtual and real is jarring, the scale made alignment not possible - unlike even in Quest1, although it had very bad resolution, its passthrough scale is mostly align with the real. This is not what I expected - I planned to marvel at the seamlessness of my hands went from real to virtual, just like 8 years ago with Touch controller of Rift CV1 - but not the case here.

Would this affect me using the device or damaging any confidence when walking around? I don't think so. But it's there.

I try to come up with an explaination for this scale artifact. Maybe their automatic IPD recognition is not that precise. Maybe the 4 years old optometry data for the lens I gave them is a little off for me(but I wear that glass all day). But when I asked somebody else afterwards, the conclusion is the same: Quest has better perspective ratio. So maybe, according to Reality Labs Director of Engineering for XR Tech Ricardo Silveira Cabral - [""The biggest lesson we've learned from Passthrough is that mathematically optimum points don't necessarily mean perceptual optimums,""](https://www.meta.com/blog/quest/ai-powered-technologies-quest-3-pro-ray-ban-meta-smart-glasses/), and experience matters.

OK, now I understand why people give the passthrough experience of VP a 8.5 but give Quest 3 also a high 7. Last time I saw this rating I thought it's just not making any sense. 

Of course, VST is not easy. This is one of those classic technologies that, when done right, people assume you did nothing. ""Huh? Why not just bump up some resolution? You cheap bastard"" ""Ah it's shit because it's not reality level yet,"" totally ignorant of the technological marvel it is to synthesis a completely new frame for your eye from different camera perspectives, in just a few milliseconds. By the way when I saw the 12 millisecond claim in the keynote, I gasped. Not because of how Apple achieved this, but because of how cleverly they advertised it - people with only a skin-deep understanding of VR would surely remember the 20ms motion-to-photon latency claim, but what Apple did here is photon-to-photon latency, with a fixed algorithm and always on so they can easily accelerate it with a dedicated chip R1. People would definitely conflate those two and news all over claimed Apple reinvented VR - and that's exactly what happened. But if we follow Apple's logic then any optical see-through AR headset could claim 0ms photon-to-photon latency of the real world. Again, Apple is not lying, but dare I say intentionally misleading. Their VR content latency is definitely not 12ms since that would be rendered by the M2 rather than R1 chip - if it were, they would advertise the hell out of that without any asterisk.

The overall feeling of VST is at Quest3 level, stereoscopic 4 million pixels vs 6.5 million for Apple. But Apple's VST seems has higher dynamic range - since there was no additional temporal budget for smart HDR under 12ms constraint, while Quest only uses 1 for each eye, I think AVP uses more cameras, not only capture more information to make up for near field distortion but also at different ISO level to reconstruct the scene at a higher dynamic range.

I turn the dial on my head to enter a VR environment, then look down. My hands are culled out with rough edges, as you may have seen in videos online. My arm with black clothes is also culled out. I take out a phone and put it in my hand, and it becomes part of the VR scene, occluding part of my hand as if I’m holding a cloaking device - but the fingertips are still recognized, impressively.

Now let me examine the screen quality. What better place than the Environments as seen in Apple's trailer? The Environment tab is on the left under Applications and People. There are 13 ""Environments"" with dark/light variants - 8 scenes: Haleakalā, Yosemite, Mount Hood, Joshua Tree, White Sands, the Moon, plus two coming soon; Also 5 color filter ""lights"" - Spring, Summer, Fall Winter, plus Morning - essentially color temperature filters over real life with some sound effects like bird chirps. The main VR environments resemble the photogrammetry Post Cards in Valve's The Lab, both in art style and scene selection. Anyway, they are gorgeous, but with some artificial plastic look up close (like underfoot rocks) typical of photogrammetry. Distant trees can look very 2D. After downloading all available environments, they occupy 1.33GB, on top of the 11.97GB VisionOS.

I opened YouTube in Safari and get into some HDR videos. It's very clear, but I don't feel it's that far above Quest 3 given the higher pixel count implies, there's a bit softness, and I see little difference between choosing 1080p and 1440p in Youtube. Blacks are of course very black, but it's not very bright - contrary to reports of lifelike fire and eye-searing light. This is expected - 5000 nits hitting pancake lenses yields 500 nits if lucky. I also tried finding VR YouTube clips, but there's no forced VR viewing button in Safari like the Meta browser offers.

I also tested eye tracking typing like [MKBHD suggested here](https://youtu.be/dKbT0iFia0I?t=2038) on the virtual keyboard, looking at each letter before tapping as fast as I can - it works, but proves harder than expected. I'm used to glancing, not deliberately focusing. This was unexpected regarding this interface mechanism, and become a pain in the ass as I will explain later. I tried holding a pinch on the timeline to slide left and right, and then looking at specific point on the timeline then tap. All work well as intended, until I finally finished fidgeting around and tried tapping the full-screen button below - I just tapped at the end of the timeline. I tried again, nope. Nearly impossible until I centered my view on that button like early Gear VR with only head aim - finally got it. Forget nonchalantly glancing at the periphery, you have to focus deliberately, defeating eye tracking's purpose here.

Of course, I have to consider if the issue is on my end first, as Apple fans often point out. Maybe the eye registration wasn't quite right causing some mismatch there. And of course if YouTube had a native app, it would follow Apple guidelines like putting small visible buttons inside larger invisible eye tracking zones, as opposed to putting buttons so close that Apple has to determine user intention...and fails.

Eye tracking is a bottomless tech pit once you dig deeper, unlike entitled gamers in the VR community thinking it's just a simple checkbox feature. Wearables are hard given human variability; your eyes change throughout the day and over time. Double the eye tracking cameras didn't ease use or increase tracking volume compared to Quest Pro from the limited time I used - it still notified me when your eyes were too close or far (something to keep in mind if you plan to get your eyes as close to the lenses as possible to maximize FOV), just like Quest Pro. Even after adjustment I'd have to fidget again sometimes - so here goes the advantage of using pancake lenses, or trying to play some fast-motion games.

Bottom line - don't expect a magic end-all solution yet - there's still huge room for improvement. I heard some people even struggled to aim for a button after taking off and putting on the headset again. I happened to notice one time graphics get very pixelated outside foveated regions.

Now I will explain the ""pain in the ass"" part: You know with popups like permission request, ""Yes"" is on the bottom left, and ""No"" on the bottom right. Normally I'd glance through from the top left to the bottom right, then simultaneously click Yes on the bottom left without focusing. Of course that fails here - I mistakenly hit No a few times, which is very annoying. I thought maybe it's just my habit - read casually and decide on the button without a second thought. But afterward talking to another developer porting an app into the device, and when he got the permission pop-up he accidentally denied hand tracking access and had to find the feature and re-enable it in settings, said ""Sigh, there goes at least 10% of consumers.""

In my mind before trying this UX scheme, I thought this would be intuitive and learnable fast. Yet I didn't realize adaptation takes time. You have to know the eye tracking reaction limits and change your information consumption pace and rhythm, and things become more deliberate rather than casual. No wonder Apple is hesitant to add more complex control schemes.


Let's go through the home UI, though I'm sure you've seen plenty of videos/emulator footages already, and this is long enough. Notably there is an Airplane Mode in settings - I didn't try but suppose you have to toggle it manually rather than the system detecting flights. 

My main Quest UI complaint is the 3 app limit Multi-window flexibility - sometimes that's just not enough when juggling between apps and settings. Accidentally replacing a window state brings subtle frustration. Within my VisionOS testing time, supporting more freely placeable windows helped, but issues remained - often when pressing the digital crown to back home, I'd forget my prior home menu browsing state and have to reselect. Probably my habits to blame here and also I haven't gotten familiar enough with the system, but this showed 3D UI design difficulty nonetheless.

I remember the touted Multi-App 3D Engine - the only thing Apple said it's ""first of its kind"" in the whole VisionOS system stack introduction, and it's all about how multiple apps or windows should interact with each other. The transparency seemed beautiful if battery intensive, and from early days alpha testing and blending are a big no no. So I assumed Apple would limit real transparency layers, using UX design tricks like merging non-focused layers into one or only showing near-opaque subtle coloring of the background when multiple layers are view-aligned. Most of the time it's like that, but intentional testing showed 4 transparent content layers plus background impressively, and I can make out the words on each layer, albeit with some frame drops. Shadows are obviously pre-baked so it can only projected onto either desk or floor but not simultaneously. I assume all these default effects including transparency and shadow are handled by R1, since the chip have to reconstruct the scene at all times.


As I pixel-peeping at the content in half-transparent windows and moved my head around, I noticed another thing - motion blur! It's another shock to me, to the point of even a little confusion - chromatic aberration, motion blur - all these ""fixed"" problems from early days, all of sudden reappeared in this flagship VR product from Apple. What happened? This is definitely not within my expectations. But Why didn't I notice it at first? Oh I focused on the VST quality which already has some motion blur artifacts. Also, the high resolution of the screen definitely helped counter these artifacts, and when in VR scenes I didn't notice them at all, but I'm not sure in a fast moving VR game situation it won't be a distraction, which I have no way to test now. My mind was racing with explanations - PSVR2 from Sony also suffers from the same problems, since this micro-oled was also by Sony - an HDR issue? 5000 nits to pancake lenses yields 500 nits if lucky; if adding low persistence that would bring the display to sub 200 nits range. Again, trade offs.

Filming spatial video was easy with the dedicated button on the headset - the depth seems much better than iPhone's camera narrow separation could ever produce, on par with average VR180. The lighting condition here is optimal so I cannot assess other situations but at least the overall quality here is better than I anticipated. The UI also helps a lot - a layer of haze around the content make it felt more like a memory, tapping into cultural sci-fi connections. Besides viewing the video in a window, pressing full screen can make it almost VR180 which do not seem to enlarge the video a lot since the window was already very close to you, but the quality drop is immediate obvious, I can see some color blocks here and there.

The panorama is great, and since most panoramas capture distant scenes, sometimes you would get illusory depth. By the way, I saw people already complain about why Apple cannot just let set panorama as a desktop wallpaper themselves - and I anticipate lots of similar complaints from people that know nothing about the tech and just assume something would work as they imagined.

Though I haven't seen Eyesight on the external display, aiming at people in real life while in VR environment, they would slowly and smoothly fades into VR like showed in promos - nice to have but not that technologically impressive considering what we have today, since it's not about whether other people is looking at you or not, clearly its just analyzing passthrough feed, and fade in people if your aiming happened to locate any human in that direction, nothing about face let alone eye contact recognition as somebody assumed.

The meditation app is simple and relaxing, as an avid practitioner I often prefer no digital help when sitting in a chair for hours straight, but I can see myself using this one.

Battery life matches Quest 3 despite I mostly just did some menu browsing, the most intensive use was the VR environment with a few minutes of Youtube HDR video watching in Safari (Or maybe multi-window interaction in MR?). I intentionally did not charge the device, and there's 30 30-second countdown before it shuts off. 

Taking off the headset, pros are mostly within my expectations, except for cons. The overall sentiments from developers I talked to largely felt the execution was not as high as they imagined - it's essentially a higher-spec Quest 3.



Zuckerberg said **there's no kind of magical solution that Apple has to any of the constraints on laws and physics that our teams haven't already explored and thought of**, and that's truer than ever after I used AVP for half of the day. By the standard of this device, if Apple produced a headset that is exactly like Quest3, they would sell it at least $2000, which is actually fair if you compare Quest to any other consumer electronics on the market, in terms of hardware spec, R&D tech, and cost packed in. That's not counting any contents in the library that Meta has accumulated all these years.

I remember when I watched the WWDC keynote last year, I had certain fuzzy anticipations since I discarded all the rumors about the dual M2 chips or 8k displays, which based on my understanding of the industry, are ultra bullshit. But indeed, Apple did come out with another approach - using R1 to process all the sensor data and SLAM, scene reconstruction, even pre-baked all the spatial effects for apps, and leaving M2 for all the general tasks. Still, using a GPU at most 1.7x XR2Gen2 but having to render more than 2.5x pixel count compared to Quest3 is not ideal, so they also packed in foveated rendering, and urged developers to mostly work for AR instead of ""full screen"" VR, thus easing the rendering pressure for M2, emphasizing on the CPU side of things, which is the strong suit right now for Apple's chips. From this computing structure perspective, it's really an AR device, but unfortunately it did not get rid of any pitfalls of the VR devices today. It's still very heavy, in fact heavier than Quest 3 even without battery, and its battery lasts on par with Quest 3, despite having at least double the raw capacity. So the question is: what advantages do you get for Vision Pro? Can it stand as a first gen product?

I have my doubts. Looking back at iPhone1, you can actually see some parallel: for that product in 2007, they mostly focused on the multi-touch interface, and maybe ""wasted"" a lot of computing power and battery on a 1300mAh device solely for that feature. Similarly, Vision Pro has so many sensors to make sure your eyes and hands are captured to the point of some people might think is overkill. But from the perspective of UX design, the basic input mechanism should leave no room for frustration. It's just this time, against the much variability and volatility of the human body and real world situations, the end result leaves me wondering if it's worth it. Granted, for average people it won't be much of a problem, it's just you can easily get frustrated by the limitations of what current tech is capable of providing. They used much higher specs to compensate for the lack today, but even discounting the price, the weight, thermal, and battery life are all trade-offs compared to Quest 3, which I'm not sure a well-informed and non-biased person would pay. And for the battery itself - if you have to put this battery in your pocket all the time since Gen1, what kind of battery should you use following its trend? History told us it can only go up, like we have 5000mAh smartphones today. Or maybe AVP Is really just a laptop and we have to attach to a power cord all day.

Of course, one of the biggest arguments is display. Can these devices replace your monitor? I think the line is very blurry here since both Q3 and AVP surpassed the usable line and it would finally comes down to people's preference: the Vision Pro's screen doesn't have screen-door effect, but also don't expect 4K HDR as the overall quality is closer to a cheap 1440p HDR display when simulating a screen, some subtle motion blur, more vivid color, very nice close-up passthrough, narrower FOV, while Quest 3 has a slight screen-door effect, lower resolution, worse color, more true-to-life scale of the passthrough, and is lighter. Overall obviously VP's display is a net win, but If you take weight into consideration, I would rather use my laptop or 4K projector when doing long work session or media viewing, and that's the whole point of VP's existence.

Everyone has a different answer, but everything considered, I found myself leaning towards Quest 3 more - even though I think my digital lifestyle may fit more toward what Apple suggested here - I can just lie down and watch YouTube all day long for months straight and I've used Oculus Go to watch YouTube until 5AM, but it's not something enticing to wear a headset. Viewing webpages while scrolling with my hand on my leg without moving much is nice, but my head would also suffers more weight. And I can do most of the 3D things in Quest 3 with controllers better. I love VR and put a lot of time thinking about it, so I know the pattern after novelty wears off.

For Quest 3, I think Meta has the right power distribution among all the necessary features, constantly iterates on the minimal usable experimental features without stepping up too much - it's like yeah better mixed reality is nice, but is that 1 hour less battery and 100 grams more nice?. You can always add in a battery pack later for Q3, on your head for balancing or in your pocket just like Vision Pro. Right now Meta could accelerate on bringing more productivity apps (translation: 2D apps) into their ecosystem now, as the resolution is finally caught up to make it useful. Palmer Luckey said you have to make a headset everybody wants before everybody can buy, which I agree partially, because ultimately you are not just building a headset, you are also building the entire ecosystem, which consists of developers, supply chain, and consumers. Unlike Apple, Meta does not have the luxury of any existing platform, so they had to bootstrap the whole ecosystem one by one and do not skip any intermediate steps. If they sell expensive, they won't sell many and fewer devs would buy in to develop for the device, and even fewer people would buy and fewer quantity means components become more expensive, so the price would go up…few people understand this and just whiny for certain better specs. Fortunately, this tipping point is coming, and right now Meta could be even more aggressive; Apple certainly could bring more mainstream attention into this field that we all love.

Anyway, I'm excited for the future, for anyone out there, manage your expectations, be patient, on this road of realizing the dream of ""being anyone, go anywhere, do anything"". See you in the metaverse!",1034,1aetqks,OculusQuest,https://www.reddit.com/r/OculusQuest/comments/1aetqks/long_posttried_vision_pro_heres_what_i_thought/,294,1706635179.0
Apple Vision Pro Battery Pack Power Cable is Removable,,1042,1afs8b3,apple,https://www.macrumors.com/2024/01/31/vision-pro-battery-removable-cable/,284,1706734037.0
"Stop wearing Vision Pro goggles while driving your Tesla: U.S. transportation officials, Calif. police",,3458,1ako3qn,technology,https://www.nytimes.com/2024/02/06/technology/personaltech/apple-vision-pro-tesla.html,345,1707261985.0
"Apple Vision Pro, thoughts?","Just seen on the Apple WWDC event.

Is this industry changing? Will we see the industry explode again?",283,141ni50,virtualreality,https://www.reddit.com/r/virtualreality/comments/141ni50/apple_vision_pro_thoughts/,1434,1685989524.0
"No, Apple Didn't Really Cut Vision Pro Production By 50%","Heaney points out that this entire news cycle is based on Kuo backpedaling. Kuo originally gave a number that other analysts agreed on, then went to a much higher number that everyone called out as impossible and now that he’s gone back, he’s saying it’s Apple’s fault instead. ",1121,1ccsnv0,apple,https://www.uploadvr.com/apple-vision-pro-production-cut-claims-debunked/,211,1714053587.0
Apple reportedly slashes Vision Pro headset production and cancels updated headset as sales tank in the US,,2406,1cc6sbe,technology,https://www.pcgamer.com/hardware/vr-hardware/apple-reportedly-slashes-vision-pro-headset-production-and-cancels-updated-headset-as-sales-tank-in-the-us/,600,1713985904.0
Me watching some guy blow $3500 on an Apple Vision Pro,,3294,1bxtfsf,cyberpunkgame,https://i.redd.it/hv4lfgd1zysc1.jpeg,102,1712457394.0
Mark Zuckerberg's take on the Vision Pro. Tbh it's interesting,,697,1aqjcub,VisionPro,https://v.redd.it/etr3zb3lxiic1,611,1707904720.0
$300 Vision Pro developer strap is just an expensive USB2 device,,1707,1akz1jt,technology,https://appleinsider.com/articles/24/02/06/300-vision-pro-developer-strap-is-just-an-expensive-usb2-device,230,1707297716.0
Vision Pro Theatre Mode,,410,1an68z7,apple,https://youtu.be/ASpw213hvh0?si=uJYHshlErpzemx1T,206,1707533905.0
bu apple vision pro nasıl kullanılıyo amk,,1215,1dyvc57,KGBTR,https://i.redd.it/zsf80z8brfbd1.jpeg,66,1720505879.0
"Some Apple Vision Pro users suffer black eyes, headaches and neck pain",,1640,1c02sgt,technology,https://www.marketwatch.com/story/some-apple-vision-pro-userssufferblack-eyes-headaches-and-neck-pain-626291fc,219,1712695680.0
Video of Tesla Driver Wearing Vision Pro Sparks Government Warning,,1346,1akaj8q,apple,https://www.macrumors.com/2024/02/06/idiot-driver-seen-wearing-apple-vision-pro/,224,1707228369.0
