Title,Text,Score,ID,Subreddit,URL,Num_Comments,Created
Get Officially Verified as a Vision Pro Owner,"We are introducing a new custom ""Verified Vision Pro Owner"" Reddit Flair. If you have it, users will trust that you are speaking as someone who has extensive experience with Vision Pro. In [our Discord server](https://discord.gg/yRJmAhAQvX), verified owners also have access to exclusive channels to chat and share content with other owners!

[This flair will appear next to your username](https://preview.redd.it/iboi52gnq6gc1.png?width=1238&format=png&auto=webp&s=666a321a42cffafb6cdf8a4820f93b793d7865f2)

**To Get Verified:**

1. Hand-write your Reddit username on a slip of paper.
2. Take a picture of the slip of paper next to your Vision Pro.
3. Send your picture as a comment on this post.

If you would like to be verified on Discord please make sure that you have joined [our Discord server](https://discord.gg/yRJmAhAQvX), then TYPE your Discord username in your comment alongside your picture.

For the Developer flair, follow the instructions in [this post](https://www.reddit.com/r/VisionPro/comments/1b201up/get_officially_verified_as_a_vision_pro_developer/).",243,1ah5kmg,VisionPro,https://www.reddit.com/r/VisionPro/comments/1ah5kmg/get_officially_verified_as_a_vision_pro_owner/,3012,1706885730.0
The $3500 Apple Vision Pro has arrived - but you can't use Netflix or YouTube on it,,3549,19cl1mh,wallstreetbets,https://www.forbes.com.au/news/innovation/apple-vision-pro-wont-have-access-to-netflix-or-youtube-at-launch/,778,1705890951.0
I LOVE MY APPLE VISION PRO,,4550,1am8q3t,okbuddyretard,https://i.redd.it/zz6naiawxfhc1.png,28,1707432657.0
finally got the new apple vision pro,,2452,1aljuph,teenagers,https://i.redd.it/tm3pdc8lm9hc1.png,60,1707356220.0
It didn’t take long for everyone to forget about apple vision pro.,,1562,1brhu98,Showerthoughts,https://www.reddit.com/r/Showerthoughts/comments/1brhu98/it_didnt_take_long_for_everyone_to_forget_about/,263,1711805147.0
Apple Vision Pro Features 16GB of RAM and Likely Up to 1TB of Storage,,1651,192lq3p,apple,https://www.macrumors.com/2024/01/09/apple-vision-pro-how-much-ram-and-storage/,503,1704825067.0
"We’re giving away this brand new Onewheel GT S-Series & Apple Vision Pro ($7,500 value)! 😳 Enter to win in comments.",,16904,1ajlrna,onewheel,https://www.reddit.com/gallery/1ajlrna,30391,1707153343.0
Apple reminds devs to ‘Get ready’ for Vision Pro as launch nears,,1263,18n3bk7,apple,https://9to5mac.com/2023/12/20/apple-reminds-devs-get-ready-for-vision-pro/,444,1703101439.0
Facetime call in apple vision pro looks like 480p 🤢🤢🤢,,913,1aeq3n1,applesucks,https://i.redd.it/qkz67i5oblfc1.png,314,1706626123.0
Apple’s Testy Developer Relationships Threaten to Hamper Vision Pro,,809,19c3r15,apple,https://www.bloomberg.com/news/newsletters/2024-01-21/apple-vision-pro-lack-of-netflix-youtube-app-store-tensions-threaten-device-lrnjwjb3,388,1705844801.0
Apple Vision Pro’s Lengthy Sales Pitch Will Include 25-Minute Demo,,1176,196g8dg,apple,https://www.bloomberg.com/news/newsletters/2024-01-14/how-to-buy-apple-vision-pro-3-499-device-to-go-on-sale-feb-2-lrdjtdm7,407,1705239975.0
Finally! Ordered my Vision Pro!,Finally pulled the trigger. Can’t wait until tomorrow! ,254,1cukk9s,VisionPro,https://i.redd.it/0v6ktwjgw21d1.jpeg,188,1715991739.0
PSVR2 vs Apple Vision Pro,,447,143aiq1,PSVR,https://www.reddit.com/gallery/143aiq1,485,1686137001.0
WWDC24 - Vision Pro Megathread,"**WWDC24 Stream**  
**Where**: [Apple Website](https://www.apple.com/apple-events/) or [Youtube](https://www.youtube.com/watch?v=RXeOiIDNNek)  
**When**: 10:00 a.m. PT

**Announcements:**

* VisionOS 2
* Photos app update turns non spacial photos into spacial photos
* SharePlay in the photos app with spatial personas
* Mac Virtual Display gets new sizes and resolutions including widescreen
* Train support
* Mouse support
* Spatial video via Canon camera and edited in final cut + Vimeo
* New gestures: go to home screen by tapping, flip your hand over to bring control center up
* Vision Pro arrives to China, Singapore, Japan on June 28th. It will also arrive to France, UK, Germany, Canada, and Australia on July 12th.
* [See more...](https://www.apple.com/visionos/visionos-2-preview/)

https://preview.redd.it/12gxj41e3s5d1.jpg?width=1600&format=pjpg&auto=webp&s=c09e053b9400bcf1a3c1ca8b12a1b177c012daad

**Our IRL Meetup**  
**Where:** [Eureka!](https://maps.app.goo.gl/W8Gp5DMWF6yNHmeP7) (Cupertino, CA)  
**When:** 4:30 p.m. PT  
[More Info](https://www.reddit.com/r/VisionPro/comments/1cmg3pj/wwdc24_rvisionpro_meetup/)",63,1dcnt1r,VisionPro,https://www.reddit.com/r/VisionPro/comments/1dcnt1r/wwdc24_vision_pro_megathread/,322,1718032124.0
Riding with apple vision pro for the first time,,1531,1aqohip,Dirtbikes,https://v.redd.it/57zealkobkic1,120,1707921783.0
I'm working on a Google Earth like App for Vision Pro. Any thoughts?,,1234,1bltl8v,VisionPro,https://v.redd.it/uo368ce1h3qc1,318,1711204386.0
Got Flight Sim working on Vision Pro,Using ALVR installed with Xcode ,652,1b3bb4y,VisionPro,https://v.redd.it/hrzk1a6z9llc1,179,1709240657.0
Apple Vision Pro Could Take Four Generations to Reach 'Ideal Form',,852,1aoc1h2,technology,https://www.macrumors.com/2024/02/11/apple-vision-pro-fourth-generation-ideal/,372,1707669257.0
"Vision Pro can’t “extend,” only “mirror”",Thoughts? I keep seeing people talking about extending Apple displays then I saw this news broke.,322,19el0yw,VisionPro,https://i.redd.it/qfpbsuwnzeec1.jpeg,445,1706113594.0
Vision Pro Manufacturing,Making of Vision Pro,678,19ajhgq,VisionPro,https://v.redd.it/7w6i41utiedc1,86,1705672086.0
Apple’s Tim Cook shares exactly how he uses Vision Pro headset every day,,1055,1e0ugfv,apple,https://www.the-sun.com/tech/11893606/apple-vision-pro-tim-cook-interview/,234,1720718709.0
Vision Pro is not dead,"I have seen a lot of chatter online with some people thinking/worrying that Apple isn’t fully invested in Vision Pro and Vision OS…

A friend of mine is a manager at an Apple Store, and has worked for Apple for over 15 years now.

We were talking about WWDC and what we expected see, when another friend asked about how the Vision Pro was doing (in terms of sales and popularity).

He said that even though sales projections were decreased for 2024, Apple is still pushing the Vision Pro pretty hard.

He mentioned that Apple is aiming to get more people into demos, because after two demos most people are blown away and make a purchase. He said they would rather make an iPhone customer wait longer in order to put more employee resources behind providing demos of the AVP.

He also said that during EVERY employee meeting the Vision Pro is talked about and is always a hot topic. Which he said I s unlike any other product that’s been released under his time at Apple.  

So hopefully this little tidbit of info helps put to rest any concerns of Apple’s commitment to making this product line work.

It sounds like we have a bright future ahead for Vision Pro and I’m super excited for Vision OS 2.0 and above 💪🏻",182,1db1vgf,VisionPro,https://www.reddit.com/r/VisionPro/comments/1db1vgf/vision_pro_is_not_dead/,195,1717849781.0
YouTube says a Vision Pro app is ‘on the roadmap’,,1192,1ajqvsq,apple,https://www.theverge.com/2024/2/5/24062425/youtube-vision-pro-app-360-vr-video,225,1707165475.0
Tesla + Vision Pro = cops,,558,1ai4ilc,apple,https://twitter.com/CatchUpFeed/status/1753626674317705483,166,1706989863.0
Vision Pro is finally here! 😄,,391,1ah35l7,apple,https://www.apple.com,229,1706878939.0
Apple Vision Pro Review Roundup,"**Written Reviews:**

[The Verge](https://www.theverge.com/24054862/apple-vision-pro-review-vr-ar-headset-features-price) \- Apple Vision Pro review: magic, until it’s not

[CNET](https://www.cnet.com/tech/computing/apple-vision-pro-review-a-mind-blowing-look-at-an-unfinished-future/) \- Apple Vision Pro Review: A Mind-Blowing Look at an Unfinished Future

[Tom's Guide](https://www.tomsguide.com/computing/smart-glasses/apple-vision-pro-review) \- Apple Vision Pro review: A revolution in progress

[Washington Post](https://www.washingtonpost.com/technology/2024/01/30/apple-vision-pro-what-does-it-do/) \- Apple’s Vision Pro is nearly here. But what can you do with it?

[The Wall Street Journal](https://www.wsj.com/tech/apple-vision-pro-review-39f2d82e?st=3eyvayazbiwv29b) \- Apple Vision Pro Review: The Best Headset Yet Is Just a Glimpse of the Future

[CNBC](https://www.cnbc.com/2024/01/30/apple-vision-pro-review-the-future-of-computing-and-entertainment.html) \- Apple Vision Pro review: This is the future of computing and entertainment

&#x200B;

**Video Reviews:**

[The Verge](https://www.youtube.com/watch?v=hdwaWxY11jQ)

[CNET](https://www.youtube.com/watch?v=DQoU4dPig5E)

[The Wall Street Journal](https://www.youtube.com/watch?v=8xI10SFgzQ8)

[Tom's Guide](https://www.youtube.com/watch?v=snOt7Sgdxaw)",149,1aeplkc,hardware,https://www.reddit.com/r/hardware/comments/1aeplkc/apple_vision_pro_review_roundup/,417,1706624702.0
Apple Vision Pro to Feature 'Travel Mode' for Better In-Flight Experience,,1669,14g8u8h,apple,https://www.macrumors.com/2023/06/22/apple-vision-pro-travel-mode/,436,1687453574.0
Apple VisionPro Gestures chart,,783,1448jnn,apple,https://twitter.com/henricreates/status/1666629316895973376,197,1686228948.0
First ever to break the new Vision Pro,,716,1ahjrif,apple,https://twitter.com/iupdate/status/1753517090806649055?s=19,191,1706922547.0
Apple Vision Pro is Missing Something...,,365,1apgsqo,apple,https://youtu.be/hOi8s2wkX4A,234,1707786862.0
Apple’s Vision Pro battery pack is hiding the final boss of Lightning cables,,1742,1ag7be5,technology,https://www.theverge.com/2024/1/31/24057392/apple-vision-pro-battery-lightning-cable,263,1706780512.0
Watching sports are about to be insane on the Apple Vision Pro,,1542,1aj9nod,IndiaTech,https://v.redd.it/3rqihrf4kpgc1,191,1707113258.0
"Apple Vision Pro resolution vs other VR headsets (Vision Pro resolution is an estimate, exact resolution isn't confirmed but 3400x3400 is pretty close) [vrcompare]",,182,196a0wt,virtualreality,https://i.redd.it/6ky5giwsuccc1.png,557,1705216059.0
iPad Pro M4 13 Inch or Apple Vision Pro?,In the UK we are getting the Vision Pro next month. I currently have no computer as I always change up things. I was looking at getting the iPad with the magic keyboard as my full time computer but at its price with just a grand more I can get into the Vision Pro. My work load is not heavy at all hence my decision to use an iPad. I just want the best hardware and experience. What should I do? Save the money and get a “boring iPad” or get into the future of computing. ,154,1dhjfez,iPadPro,https://i.redd.it/ip9djtzfi07d1.jpeg,208,1718577900.0
Lik sa apple vision pro u Beogradu,,458,1ap1cny,serbia,https://v.redd.it/ljwv8eyp06ic1,219,1707748404.0
The real reason for the high price on the Apple Vision Pro,,1600,1ads9fk,funny,https://i.redd.it/gxqz3w44wcfc1.png,175,1706524225.0
How Apple Vision Pro headsets could change the workplace,,468,19bic3w,apple,https://qz.com/how-apple-vision-pro-headsets-could-change-workplace-1851180414,383,1705775476.0
Only for Apple Vision Pro,,656,1aj7b9y,virtualreality,https://i.redd.it/peenmfi9wogc1.png,101,1707105339.0
$300 Vision Pro developer strap is just an expensive USB2 device,,976,1akz14l,apple,https://appleinsider.com/articles/24/02/06/300-vision-pro-developer-strap-is-just-an-expensive-usb2-device,225,1707297660.0
"TechCrunch: First impressions: Yes, Apple Vision Pro works and yes, it’s good.",,1585,141ziu7,apple,https://techcrunch.com/2023/06/05/first-impressions-yes-apple-vision-pro-works-and-yes-its-good/,835,1686015826.0
Vision Pro Is Unlikely to Be the Growth Engine Apple Needs Right Now,,975,17ocacn,apple,https://www.bloomberg.com/news/newsletters/2023-11-05/apple-vision-pro-plan-includes-launching-initially-just-at-apple-stores-in-2024,614,1699192000.0
Apple Vision Pro does not support Progressive Web Apps,,619,19d1eud,apple,https://twitter.com/SteveMoser/status/1749438049300124008,239,1705945413.0
"Apple hopes to convince people to buy its $3,500 Vision Pro headset using free 25-minute in-store demos",,2598,1978yx5,technology,https://www.techspot.com/news/101521-apple-stores-offer-free-25-minute-depth-demos.html,951,1705326028.0
You can learn piano on Apple Vision Pro,,409,1aoau6v,piano,https://v.redd.it/otwfiaywxyhc1,284,1707666238.0
The Ultimate VisionPro Wishlist,"Starting a list of simple tweaks, software or otherwise, to make the VisionOs the best it can be.

Please upvote the ones you like, and add ones you don't see!

Try to search for your idea to reduce duplicates as much as possible.",158,1am5gps,VisionPro,https://www.reddit.com/r/VisionPro/comments/1am5gps/the_ultimate_visionpro_wishlist/,295,1707424328.0
"Don't try to sneak an Apple Vision Pro into Germany, the import cops will nab you",,1376,1am2gr0,apple,https://appleinsider.com/articles/24/02/08/berlin-customs-officers-confiscate-apple-vision-pro?utm_medium=rss,486,1707416807.0
"Tim Cook uses Vision Pro every day, and other earnings call info",,1286,15i0d6t,apple,https://9to5mac.com/2023/08/04/tim-cook-uses-vision-pro-every-day-most-iphones-bought-on-some-kind-of-program/,386,1691156355.0
"Apple Vision Pro launch pre-view testers complain about weight, comfort, even headaches",,964,198qbba,technology,https://www.notebookcheck.net/Apple-Vision-Pro-launch-pre-view-testers-complain-about-weight-comfort-even-headaches.793754.0.html?utm_source=dlvr.it&utm_medium=twitter,380,1705474005.0
"Apple Vision Pro Unlikely to Hit 500,000 Sales This Year, Says IDC",,483,1e0q9t0,apple,https://www.macrumors.com/2024/07/11/apple-vision-pro-under-500000-sales-this-year/,320,1720708043.0
Vision Pro,,1327,142krlk,Bitcoin,https://i.redd.it/rxmpr2lf8f4b1.jpg,51,1686067559.0
Why Tim Cook Is Going All In on the Apple Vision Pro & First Photo Of Him Wearing It,,1865,1agfj8d,gadgets,https://www.vanityfair.com/news/tim-cook-apple-vision-pro,852,1706806295.0
"I don’t understand people saying the Vision/VisionPro will one day be $1,000","I see it thrown out there all the time on Reddit, but anyone waiting for a $1,000 Vision or VisionPro is going to be waiting forever.

The iPhone 15 retails at nearly $1,000, yet the VisionPro has *8x as many pixels* squeezed into tiny specialty displays, *4x as many cameras* including specialty cameras like LIDAR, an M2 processor *and* a new R1 chip, and who knows how much more glass metal and fabric.

I don’t think people throwing around a $1,000 future price tag truly understand how much is under the hood of the VisionPro. They should be thinking in terms of MacBook/MacBookPro pricing.

I’d be ecstatic to be proven wrong though.",272,1amgbuh,VisionPro,https://www.reddit.com/r/VisionPro/comments/1amgbuh/i_dont_understand_people_saying_the/,510,1707455022.0
Cook sets eyes on enterprise as prime market for the Apple Vision Pro,,1023,1an4w71,apple,https://twitter.com/AppleNewsAlert/status/1756129686348771418?ref_src=twsrc%5Etfw%7Ctwcamp%5Etweetembed%7Ctwterm%5E1756129686348771418%7Ctwgr%5E9588ed1de8ad16cd3f10745da743d54d83d8b728%7Ctwcon%5Es1_c10&ref_url=https%3A%2F%2Fpublish.twitter.com%2F%3Furl%3Dhttps%3A%2F%2Ftwitter.com%2FAppleNewsAlert%2Fstatus%2F1756129686348771418,289,1707529740.0
Vision Pro Teardown,,325,1aibb0t,apple,https://youtu.be/JVJPAYwY8Us?si=q807emmRCSoBv0fY,115,1707008200.0
Apple Vision Pro is a game changer in the bathroom,Found this gem on twitter,1745,1bdcajh,VisionPro,https://v.redd.it/ebt13kfunznc1,78,1710286496.0
OpenAI CEO: Vision Pro is '2nd most impressive tech' since iPhone,,1115,1ao17lu,apple,https://venturebeat.com/ai/openai-ceo-sam-altman-says-apple-vision-pro-is-2nd-most-impressive-tech-since-the-iphone/,251,1707631890.0
"MacBook and Apple Vision Pro owners, are you still using your Apple Vision Pro?","As somebody in the UK waiting to buy the Apple Vision Pro, I’m curious. Are people still using their Apple Vision Pro regularly?
Say you are at home by yourself. You want to use your MacBook for whatever reason. Do you start up your MacBook and get going straight away? Or do you pair it with an Apple Vision Pro first and use it that way?

I’m trying to avoid the use case of watching media, as that is obviously better on the Apple Vision Pro than on a MacBook.",47,1cpft1p,VisionPro,https://www.reddit.com/r/VisionPro/comments/1cpft1p/macbook_and_apple_vision_pro_owners_are_you_still/,138,1715428467.0
"Apple never ""cut"" Vision Pro orders, 700k-800k sales projection was ""made up"" by one analyst",,2189,1clshzd,technology,https://daringfireball.net/linked/2024/05/06/vision-pro-sales-are-going-just-about-as-expected,157,1715025537.0
Unity drama will probably kill the Apple Vision Pro,"[Apple partnered with Unity](https://blog.unity.com/engine-platform/unity-support-for-visionos) to create Polyspacial, a system for developing on the Apple Vision Pro. The problem is, pretty much [all devs have been outraged by the new fee structure](https://www.theguardian.com/games/2023/sep/12/unity-engine-fees-backlash-response) (charging 20 cents for every download) and many have declared an intention to leave Unity for other platforms and even delete their games altogether. 

The main alternative is the Unreal Engine by Epic Games. Epic Games had [a huge lawsuit](https://en.wikipedia.org/wiki/Epic_Games_v._Apple#Decision) with Apple because Epic didn't like the Apple tax on their App Store revenue. 

So Apple Vision Pro will have basically no devs for their platform just as they need them to create apps to make this hunk of overpriced glass and aluminium worth buying. ",785,16idgkd,wallstreetbets,https://www.reddit.com/r/wallstreetbets/comments/16idgkd/unity_drama_will_probably_kill_the_apple_vision/,268,1694682445.0
The VisionPro is utterly amazing,"I got my VisionPro today and I am supremely impressed. Setup was a breeze. The whole experience is amazing. This definitely has to be one of the best purchases ever.

If it means anything, I actually made this post with the VisionPro!

What are your thoughts on the device?",206,1e1vjj4,VisionPro,https://www.reddit.com/r/VisionPro/comments/1e1vjj4/the_visionpro_is_utterly_amazing/,128,1720826038.0
The Vision Pro Makes me sad..," As Heavy High end pcvr guy , the vision pro just makes me angry that we can't seem to get two things that go together. 

I've invested way too much money to get the best experience from VR, 4090 , Crystal, currently but have owned Aero, (kx, g2 ,Vive pro 2 etc...you get it. I've had every iteration of the quest. Yay. 

Having the Vision Pro for 3 days now, seeing how great an actual is for vr/are is vs Android based Launcher or terrible PC front end software..... The biggest hurdle to VR, just getting into the environment is essentially removed, amazing screens, amazing battery life, etc from a company THAT DOESN'T LET YOU GAMEON IT. 

So over here we have super expensive PC with wired headset and bugs, and friction. OR standalone quest, which (while admittedly great for the money) with laggy software and not quite pcvr level games. On the other hand, we have a company who put out something on their first effort that kind of puts all of this other stuff to shame, had the capability to play pcvr level games BUT the company doesn't want you to use it for that..


Seems like we can't ever get two things that go together. 

Sigh.",250,1alac2y,virtualreality,https://www.reddit.com/r/virtualreality/comments/1alac2y/the_vision_pro_makes_me_sad/,242,1707331680.0
Apple Vision Pro Battery Supports Up to 2.5 Hours of 2D Video Playback,,1163,191onhw,gadgets,https://www.macrumors.com/2024/01/08/apple-vision-pro-battery-life-video-playback/,350,1704730133.0
The TRUTH about the Apple Vision Pro,,532,1ap4kc8,oculus,https://v.redd.it/uj2uiym9p6ic1,151,1707756689.0
"Kuo: Vision Pro Mass Shipments Begin Next Week, Launch by February",,899,18qmr8o,apple,https://www.macrumors.com/2023/12/25/vision-pro-mass-shipments-timing-kuo/,237,1703524770.0
Apple Vision Pro return rate appears low,,342,1asjshr,VisionPro,https://appleinsider.com/articles/24/02/16/so-far-the-early-return-rate-on-apple-vision-pro-is-pretty-low,221,1708118000.0
"This was my first thought when I first saw Apple Vision pro, this is the Silicon Valley future we don't need.",,6414,1ahs0sd,fuckcars,https://v.redd.it/lcc2glmx5cgc1,303,1706951190.0
Apple Vision Pro Review Roundup,"**Written Reviews:**

[The Verge](https://www.theverge.com/24054862/apple-vision-pro-review-vr-ar-headset-features-price) \- Apple Vision Pro review: magic, until it’s not

[CNET](https://www.cnet.com/tech/computing/apple-vision-pro-review-a-mind-blowing-look-at-an-unfinished-future/) \- Apple Vision Pro Review: A Mind-Blowing Look at an Unfinished Future

[Tom's Guide](https://www.tomsguide.com/computing/smart-glasses/apple-vision-pro-review) \- Apple Vision Pro review: A revolution in progress

[Washington Post](https://www.washingtonpost.com/technology/2024/01/30/apple-vision-pro-what-does-it-do/) \- Apple’s Vision Pro is nearly here. But what can you do with it?

[The Wall Street Journal](https://www.wsj.com/tech/apple-vision-pro-review-39f2d82e?st=3eyvayazbiwv29b) \- Apple Vision Pro Review: The Best Headset Yet Is Just a Glimpse of the Future

[CNBC](https://www.cnbc.com/2024/01/30/apple-vision-pro-review-the-future-of-computing-and-entertainment.html) \- Apple Vision Pro review: This is the future of computing and entertainment

&#x200B;

**Video Reviews:**

[The Verge](https://www.youtube.com/watch?v=hdwaWxY11jQ)

[CNET](https://www.youtube.com/watch?v=DQoU4dPig5E)

[The Wall Street Journal](https://www.youtube.com/watch?v=8xI10SFgzQ8)

[Tom’s Guide](https://www.youtube.com/watch?v=snOt7Sgdxaw)",164,1aepiq2,virtualreality,https://www.reddit.com/r/virtualreality/comments/1aepiq2/apple_vision_pro_review_roundup/,257,1706624464.0
Vision Pro Debut Brings a New Shopping Experience to Apple,,828,1aio8cg,apple,https://www.bloomberg.com/news/newsletters/2024-02-04/apple-vision-pro-how-to-buy-3-499-headset-apple-store-buying-experience-ls7k2exl,180,1707054367.0
"Apple Vision Pro review: magic, until it’s not",,296,1aepayx,virtualreality,https://www.theverge.com/24054862/apple-vision-pro-review-vr-ar-headset-features-price,457,1706623856.0
Haven’t used my VisionPro in a week,"I realized today that I haven’t used or thought about my VisionPro in a week. It takes intention to remember to use it. There isn’t a thing it does better for me than what I already have. I think if I travelled more I’d use it more.

Anyone in a similar situation?
",230,1aydldq,VisionPro,https://www.reddit.com/r/VisionPro/comments/1aydldq/havent_used_my_visionpro_in_a_week/,486,1708726923.0
"Mark Zuckerberg on Instagram: ""I tried Vision Pro. Here's my take ...""",,521,1aq8eu0,virtualreality,https://www.instagram.com/reel/C3TkhmivNzt/,494,1707867983.0
"Kuo: Apple Will Only Produce Up to 80,000 Vision Pro Headsets for Launch, Sellout Likely",,1492,1949dsx,apple,https://www.macrumors.com/2024/01/11/kuo-vision-pro-sellout-likely/,381,1704999457.0
Ever video of the Vision Pro just reminds me of this painting,,1922,1altc3i,Cyberpunk,https://i.redd.it/v47c6ds0hchc1.jpeg,104,1707390655.0
bearish Apple? knockoff Vision Pro goggles already hitting the streets,,1712,1apiw3l,wallstreetbets,https://v.redd.it/65u3x1dzo9ic1,80,1707792860.0
Apple unveils new AR headset “VisionPro”,,315,141nqhp,OculusQuest,https://techcrunch.com/2023/06/05/apple-headset/amp/,675,1685990013.0
Finally got a vision pro.,,669,1an9gbr,virtualreality,https://i.redd.it/7lldjrw77phc1.jpeg,77,1707544748.0
"Right to repair compliance checks: iPhone 15 = A, Vision Pro = F",,740,1duerfj,apple,https://9to5mac.com/2024/07/03/right-to-repair-compliance-apple/,200,1720014399.0
Vision pro size comparison to the quest 3,,484,1ahelwn,virtualreality,https://www.reddit.com/gallery/1ahelwn,184,1706908843.0
"Apple Vision Pro Launches in UK, Canada, France, Germany, and Australia",,457,1e1eawg,apple,https://www.macrumors.com/2024/07/12/apple-vision-pro-launched-uk-canada-france-germany/,166,1720780033.0
Throwing Infinite Money with Apple Vision Pro,,468,1as9e3h,virtualreality,https://v.redd.it/y7neun14fyic1,145,1708092382.0
Someone managed to remove the Vision Pro battery cable using a SIM push pin to reveal a 24 pin lightning cable.,,2967,1afwijk,apple,https://twitter.com/raywongy/status/1752810208278061096,494,1706744620.0
Apple Reveals 'Vision Pro' Headset,,276,141ntlc,hardware,https://www.macrumors.com/2023/06/05/apple-reveals-vision-pro-headset/,365,1685990196.0
Apple’s Vision Pro Is an iPad Killer — But Not Anytime Soon,,755,1ao8a8x,apple,https://www.bloomberg.com/news/newsletters/2024-02-11/apple-vision-pro-review-3-499-headset-will-eventually-replace-the-ipad-lshk59z1,434,1707659131.0
Apple Vision Pro Battery Supports Up to 2.5 Hours of 2D Video Playback,,974,191olrt,apple,https://www.macrumors.com/2024/01/08/apple-vision-pro-battery-life-video-playback/,339,1704730009.0
More than half of Fortune 100 companies have bought Vision Pro units according to Apple. So it's sold at least 50 then,,4651,1cja71b,gadgets,https://www.pcgamer.com/hardware/vr-hardware/more-than-half-of-fortune-100-companies-have-bought-vision-pro-units-according-to-apple-so-its-sold-at-least-50-then/,233,1714746857.0
Playing GeForce Now on Vision Pro,,361,1ahgofo,GeForceNOW,https://i.redd.it/4n8mh2t149gc1.png,185,1706914146.0
Apple Vision Pro,,336,1b1dvh5,RepTronics,https://i.redd.it/omyqilg575lc1.jpeg,82,1709046018.0
Apple announces more than 600 new apps built for Apple Vision Pro,,798,1agbsih,apple,https://www.apple.com/newsroom/2024/02/apple-announces-more-than-600-new-apps-built-for-apple-vision-pro/,229,1706796448.0
